9	If you request , we will supply you with the relevant personal data in a commonly used , machine-readable and interoperable format where it is technically feasible , you can ask us to send this information directly to another IT system provider if you prefer 	www.fireproofgames.com/
9	It means you have the right to obtain a copy of your Personal Information 	www.hotukdeals.com
9	Right to data portability You have the right to ask the portability of your Personal Information 	www.hotukdeals.com
9	It means you have the right to receive Personal Information you have provided to Us , in a structured , commonly used and machine readable format 	www.hotukdeals.com
9	9.3 Data Access and Portability You are entitled to request copies of personal information that you have provided to us in a structured , commonly used , and machine-readable format and/or request us to transmit this information to another service provider ( where technically feasible ) 	www.rovertown.com
9	If you would like a copy of the information held on you please write to us 	theorytestapp.co.uk
9	For other personal information we hold , we will provide you with access ( including a copy ) for any purpose including to request that we correct the data if it is inaccurate or delete the data if Apple is not required to retain it by law or for legitimate business purposes.We may decline to process requests that are frivolous/vexatious , jeopardize the privacy of others , are extremely impractical , or for which access is not otherwise required by local law 	www.apple.com
